{
  "schema": 1,
  "project": {
    "code": "ZRF",
    "name": "ZR FLNG",
    "target": "E3D 3.1.8.1 / Administration 2.1.0.1",
    "filePrefix": "ZRF-",
    "packageName": "ZRF-SETUP-PACKAGE.zip",
    "lineEnding": "CRLF"
  },
  "mdbs": [
    {
      "name": "/MDB-ZRF",
      "default": true
    }
  ],
  "dbDefaults": {
    "type": "DESI",
    "access": "MULTIWRITE",
    "claim": "IMPLICIT"
  },
  "attributes": [
    {
      "id": "team",
      "name": "Team",
      "role": "team",
      "columns": [
        {
          "id": "kode",
          "name": "Kode",
          "type": "text",
          "required": true
        },
        {
          "id": "desc",
          "name": "Deskripsi",
          "type": "text",
          "required": true
        },
        {
          "id": "existing",
          "name": "Sudah ada",
          "type": "boolean"
        },
        {
          "id": "anggota",
          "name": "Anggota",
          "type": "refList",
          "target": "user"
        }
      ],
      "rows": [
        {
          "kode": "ZRFEQP",
          "desc": "TEAM FOR EQUIPMENT ZR FLNG",
          "existing": true,
          "anggota": [
            "SMRENDRA",
            "NMHIZQIL"
          ]
        },
        {
          "kode": "ZRFPIP",
          "desc": "TEAM FOR PIPING ZR FLNG",
          "existing": true,
          "anggota": [
            "SMRENDRA",
            "NMHIZQIL"
          ]
        },
        {
          "kode": "ZRFHDL",
          "desc": "TEAM FOR HANDLING ZR FLNG",
          "existing": false,
          "anggota": []
        },
        {
          "kode": "ZRFSFT",
          "desc": "TEAM FOR SAFETY ZR FLNG",
          "existing": false,
          "anggota": []
        },
        {
          "kode": "ZRFELE",
          "desc": "TEAM FOR ELECTRICAL ZR FLNG",
          "existing": true,
          "anggota": []
        },
        {
          "kode": "ZRFARC",
          "desc": "TEAM FOR ARCHITECTURE ZR FLNG",
          "existing": false,
          "anggota": []
        },
        {
          "kode": "ZRFHVA",
          "desc": "TEAM FOR HVAC ZR FLNG",
          "existing": false,
          "anggota": []
        },
        {
          "kode": "ZRFINS",
          "desc": "TEAM FOR INSTRUMENT ZR FLNG",
          "existing": true,
          "anggota": []
        },
        {
          "kode": "ZRFTEL",
          "desc": "TEAM FOR TELECOM ZR FLNG",
          "existing": false,
          "anggota": []
        },
        {
          "kode": "ZRFSTR",
          "desc": "TEAM FOR STRUCTURE ZR FLNG",
          "existing": true,
          "anggota": []
        },
        {
          "kode": "ZRFADM",
          "desc": "TEAM FOR ADMINISTRATOR ZR FLNG",
          "existing": true,
          "anggota": [
            "TSETIANTO",
            "AANTARIKSA",
            "PKUSUMA",
            "SYSTEM"
          ]
        }
      ]
    },
    {
      "id": "user",
      "name": "User",
      "role": "user",
      "columns": [
        {
          "id": "kode",
          "name": "Kode",
          "type": "text",
          "required": true
        },
        {
          "id": "desc",
          "name": "Deskripsi",
          "type": "text",
          "required": true
        },
        {
          "id": "free",
          "name": "Free user",
          "type": "boolean"
        }
      ],
      "rows": [
        {
          "kode": "TSETIANTO",
          "desc": "Free user (Admin)",
          "free": true
        },
        {
          "kode": "AANTARIKSA",
          "desc": "Free user",
          "free": true
        },
        {
          "kode": "PKUSUMA",
          "desc": "Free user",
          "free": true
        },
        {
          "kode": "SYSTEM",
          "desc": "Free user",
          "free": true
        },
        {
          "kode": "SMRENDRA",
          "desc": "General user",
          "free": false
        },
        {
          "kode": "NMHIZQIL",
          "desc": "General user",
          "free": false
        }
      ]
    },
    {
      "id": "disiplin",
      "name": "Disiplin",
      "role": "none",
      "columns": [
        {
          "id": "kode",
          "name": "Kode",
          "type": "text",
          "required": true
        },
        {
          "id": "desc",
          "name": "Deskripsi",
          "type": "text",
          "required": true
        },
        {
          "id": "urutan",
          "name": "Urutan",
          "type": "number",
          "required": true
        },
        {
          "id": "team",
          "name": "Team",
          "type": "ref",
          "required": true,
          "target": "team"
        },
        {
          "id": "mdbMulai",
          "name": "MDB mulai",
          "type": "number",
          "required": true
        }
      ],
      "rows": [
        {
          "kode": "R",
          "desc": "Equipment",
          "urutan": 1,
          "team": "ZRFEQP",
          "mdbMulai": 1
        },
        {
          "kode": "L",
          "desc": "Piping",
          "urutan": 2,
          "team": "ZRFPIP",
          "mdbMulai": 26
        },
        {
          "kode": "M",
          "desc": "Handling",
          "urutan": 3,
          "team": "ZRFHDL",
          "mdbMulai": 51
        },
        {
          "kode": "S",
          "desc": "Safety",
          "urutan": 4,
          "team": "ZRFSFT",
          "mdbMulai": 76
        },
        {
          "kode": "E",
          "desc": "Electrical",
          "urutan": 5,
          "team": "ZRFELE",
          "mdbMulai": 101
        },
        {
          "kode": "A",
          "desc": "Architecture",
          "urutan": 6,
          "team": "ZRFARC",
          "mdbMulai": 126
        },
        {
          "kode": "H",
          "desc": "HVAC",
          "urutan": 7,
          "team": "ZRFHVA",
          "mdbMulai": 151
        },
        {
          "kode": "I",
          "desc": "Instrumentation",
          "urutan": 8,
          "team": "ZRFINS",
          "mdbMulai": 176
        },
        {
          "kode": "T",
          "desc": "Telecom",
          "urutan": 9,
          "team": "ZRFTEL",
          "mdbMulai": 201
        },
        {
          "kode": "N",
          "desc": "Structure",
          "urutan": 10,
          "team": "ZRFSTR",
          "mdbMulai": 226
        }
      ]
    },
    {
      "id": "grup",
      "name": "Grup",
      "role": "separator",
      "columns": [
        {
          "id": "kode",
          "name": "Kode",
          "type": "text",
          "required": true
        },
        {
          "id": "desc",
          "name": "Deskripsi",
          "type": "text",
          "required": true
        },
        {
          "id": "urutan",
          "name": "Urutan",
          "type": "number",
          "required": true
        }
      ],
      "rows": [
        {
          "kode": "MODULES",
          "desc": "Modules",
          "urutan": 1
        },
        {
          "kode": "PIPE-RACK",
          "desc": "Pipe rack",
          "urutan": 2
        },
        {
          "kode": "HULL-DECK",
          "desc": "Hull deck",
          "urutan": 3
        },
        {
          "kode": "HULL-BODY",
          "desc": "Hull body",
          "urutan": 4
        },
        {
          "kode": "HOOK-UP",
          "desc": "Hook up",
          "urutan": 5
        },
        {
          "kode": "OTHERS",
          "desc": "Others",
          "urutan": 6
        },
        {
          "kode": "FUTURE-STUDY",
          "desc": "Future and study",
          "urutan": 7
        },
        {
          "kode": "DUMMY",
          "desc": "Dummy",
          "urutan": 8
        }
      ]
    },
    {
      "id": "fungsi",
      "name": "Function",
      "role": "none",
      "columns": [
        {
          "id": "kode",
          "name": "Kode",
          "type": "text",
          "required": true
        },
        {
          "id": "desc",
          "name": "Deskripsi",
          "type": "text",
          "required": true
        }
      ],
      "rows": [
        {
          "kode": "D",
          "desc": "Installed"
        },
        {
          "kode": "F",
          "desc": "Future"
        },
        {
          "kode": "S",
          "desc": "Study"
        },
        {
          "kode": "X",
          "desc": "Dummy"
        }
      ]
    },
    {
      "id": "area",
      "name": "Area",
      "role": "none",
      "columns": [
        {
          "id": "kode",
          "name": "Kode",
          "type": "text",
          "required": true
        },
        {
          "id": "desc",
          "name": "Deskripsi",
          "type": "text",
          "required": true
        },
        {
          "id": "slot",
          "name": "Slot",
          "type": "number",
          "required": true
        },
        {
          "id": "grup",
          "name": "Grup",
          "type": "ref",
          "required": true,
          "target": "grup"
        },
        {
          "id": "fungsi",
          "name": "Fungsi",
          "type": "ref",
          "required": true,
          "target": "fungsi"
        }
      ],
      "rows": [
        {
          "kode": "M1",
          "desc": "M1 Liquefaction 1",
          "slot": 1,
          "grup": "MODULES",
          "fungsi": "D"
        },
        {
          "kode": "M2",
          "desc": "M2 CO2 Removal",
          "slot": 2,
          "grup": "MODULES",
          "fungsi": "D"
        },
        {
          "kode": "M3",
          "desc": "M3 Dehyd/Hg/NGL",
          "slot": 3,
          "grup": "MODULES",
          "fungsi": "D"
        },
        {
          "kode": "M4",
          "desc": "M4 Fuel Gas & BOG",
          "slot": 4,
          "grup": "MODULES",
          "fungsi": "D"
        },
        {
          "kode": "M5",
          "desc": "M5 Inlet/AGRU/HotWater",
          "slot": 5,
          "grup": "MODULES",
          "fungsi": "D"
        },
        {
          "kode": "M6",